{
  "$schema": "http://json-schema.org/draft-07/schema#",
  "type": "array",
  "items": {
    "type": "object",
    "required": ["Component", "Element", "State", "Property", "Value"],
    "properties": {
      "Component": { "type": "string" },
      "Element":   { "type": "string" },
      "Selector":  { "type": "string" },
      "State":     { "type": "string" },
      "Property":  { "type": "string" },
      "Value":     { "type": "string" }
    },
    "additionalProperties": false
  }
}
